{
  "$schema": "http://json.schemastore.org/sarif-external-property-file-2.1.0-rtm.1.json",
  "version": "2.1.0",

  "guid": "00001111-2222-3333-8444-555566667777",
  "runGuid": "88889999-1AAA-2BBB-BCCC-DDDDEEEEFFFF",

  "artifacts": [
    {
      "location": { "uri": "apple.png" },
      "mimeType": "image/png"
    },
    {
      "location": { "uri": "banana.png" },
      "mimeType": "image/png"
    }
  ],
  "externalizedProperties": { "team": "Security Assurance Team" }
}